{
  "$schema": "http://json-schema.org/draft-07/schema#",
  "$id": "schema.story-asset.v1",
  "title": "Story Asset",
  "type": "object",
  "required": [
    "schemaVersion",
    "id",
    "type",
    "title",
    "status",
    "summary",
    "createdAt",
    "updatedAt"
  ],
  "properties": {
    "schemaVersion": { "const": "1.0" },
    "id": { "type": "string", "minLength": 1 },
    "type": {
      "type": "string",
      "enum": [
        "character",
        "world.location",
        "world.faction",
        "world.rule",
        "world.glossary",
        "outline",
        "timeline.events"
      ]
    },
    "title": { "type": "string", "minLength": 1 },
    "status": { "type": "string", "enum": ["active", "draft", "archived", "deleted"] },
    "summary": { "type": "string" },
    "aliases": { "type": "array", "items": { "type": "string" } },
    "details": { "type": "object" },
    "relatedEntityIds": { "type": "array", "items": { "type": "string" } },
    "createdAt": { "type": "string", "format": "date-time" },
    "updatedAt": { "type": "string", "format": "date-time" }
  },
  "additionalProperties": true
}
